
 /----------------------------------------------------------------------------\
 |                                                                            |
 |  yosys -- Yosys Open SYnthesis Suite                                       |
 |                                                                            |
 |  Copyright (C) 2012 - 2020  Claire Xenia Wolf <claire@yosyshq.com>         |
 |                                                                            |
 |  Permission to use, copy, modify, and/or distribute this software for any  |
 |  purpose with or without fee is hereby granted, provided that the above    |
 |  copyright notice and this permission notice appear in all copies.         |
 |                                                                            |
 |  THE SOFTWARE IS PROVIDED "AS IS" AND THE AUTHOR DISCLAIMS ALL WARRANTIES  |
 |  WITH REGARD TO THIS SOFTWARE INCLUDING ALL IMPLIED WARRANTIES OF          |
 |  MERCHANTABILITY AND FITNESS. IN NO EVENT SHALL THE AUTHOR BE LIABLE FOR   |
 |  ANY SPECIAL, DIRECT, INDIRECT, OR CONSEQUENTIAL DAMAGES OR ANY DAMAGES    |
 |  WHATSOEVER RESULTING FROM LOSS OF USE, DATA OR PROFITS, WHETHER IN AN     |
 |  ACTION OF CONTRACT, NEGLIGENCE OR OTHER TORTIOUS ACTION, ARISING OUT OF   |
 |  OR IN CONNECTION WITH THE USE OR PERFORMANCE OF THIS SOFTWARE.            |
 |                                                                            |
 \----------------------------------------------------------------------------/

 Yosys 0.30+48 (git sha1 14d50a176d5, gcc 8.3.1 -fPIC -Os)

[TCL: yosys -import] Command name collision: found pre-existing command `cd' -> skip.
[TCL: yosys -import] Command name collision: found pre-existing command `eval' -> skip.
[TCL: yosys -import] Command name collision: found pre-existing command `exec' -> skip.
[TCL: yosys -import] Command name collision: found pre-existing command `read' -> skip.
[TCL: yosys -import] Command name collision: found pre-existing command `trace' -> skip.

1. Executing Verilog-2005 frontend: /openlane/designs/spm/src/spm.v
Parsing SystemVerilog input from `/openlane/designs/spm/src/spm.v' to AST representation.
Generating RTLIL representation for module `\spm'.
Generating RTLIL representation for module `\TCMP'.
Generating RTLIL representation for module `\CSADD'.
Successfully finished Verilog frontend.

2. Generating Graphviz representation of design.
Writing dot description to `/openlane/designs/spm/runs/openlane_test/tmp/synthesis/hierarchy.dot'.
Dumping module spm to page 1.

3. Executing HIERARCHY pass (managing design hierarchy).

3.1. Analyzing design hierarchy..
Top module:  \spm
Used module:     \CSADD
Used module:     \TCMP

3.2. Analyzing design hierarchy..
Top module:  \spm
Used module:     \CSADD
Used module:     \TCMP
Removed 0 unused modules.

4. Executing TRIBUF pass.

5. Executing HIERARCHY pass (managing design hierarchy).

5.1. Analyzing design hierarchy..
Top module:  \spm
Used module:     \CSADD
Used module:     \TCMP

5.2. Analyzing design hierarchy..
Top module:  \spm
Used module:     \CSADD
Used module:     \TCMP
Removed 0 unused modules.

6. Executing PROC_CLEAN pass (remove empty switches from decision trees).
Cleaned up 0 empty switches.

7. Executing PROC_RMDEAD pass (remove dead branches from decision trees).
Marked 1 switch rules as full_case in process $proc$/openlane/designs/spm/src/spm.v:72$40 in module CSADD.
Marked 1 switch rules as full_case in process $proc$/openlane/designs/spm/src/spm.v:42$33 in module TCMP.
Removed a total of 0 dead cases.

8. Executing PROC_PRUNE pass (remove redundant assignments in processes).
Removed 4 redundant assignments.
Promoted 0 assignments to connections.

9. Executing PROC_INIT pass (extract init attributes).

10. Executing PROC_ARST pass (detect async resets in processes).
Found async reset \rst in `\CSADD.$proc$/openlane/designs/spm/src/spm.v:72$40'.
Found async reset \rst in `\TCMP.$proc$/openlane/designs/spm/src/spm.v:42$33'.

11. Executing PROC_ROM pass (convert switches to ROMs).
Converted 0 switches.

12. Executing PROC_MUX pass (convert decision trees to multiplexers).
Creating decoders for process `\CSADD.$proc$/openlane/designs/spm/src/spm.v:72$40'.
     1/2: $0\sc[0:0]
     2/2: $0\sum[0:0]
Creating decoders for process `\TCMP.$proc$/openlane/designs/spm/src/spm.v:42$33'.
     1/2: $0\s[0:0]
     2/2: $0\z[0:0]

13. Executing PROC_DLATCH pass (convert process syncs to latches).

14. Executing PROC_DFF pass (convert process syncs to FFs).
Creating register for signal `\CSADD.\sum' using process `\CSADD.$proc$/openlane/designs/spm/src/spm.v:72$40'.
  created $adff cell `$procdff$42' with positive edge clock and positive level reset.
Creating register for signal `\CSADD.\sc' using process `\CSADD.$proc$/openlane/designs/spm/src/spm.v:72$40'.
  created $adff cell `$procdff$43' with positive edge clock and positive level reset.
Creating register for signal `\TCMP.\s' using process `\TCMP.$proc$/openlane/designs/spm/src/spm.v:42$33'.
  created $adff cell `$procdff$44' with positive edge clock and positive level reset.
Creating register for signal `\TCMP.\z' using process `\TCMP.$proc$/openlane/designs/spm/src/spm.v:42$33'.
  created $adff cell `$procdff$45' with positive edge clock and positive level reset.

15. Executing PROC_MEMWR pass (convert process memory writes to cells).

16. Executing PROC_CLEAN pass (remove empty switches from decision trees).
Removing empty process `CSADD.$proc$/openlane/designs/spm/src/spm.v:72$40'.
Removing empty process `TCMP.$proc$/openlane/designs/spm/src/spm.v:42$33'.
Cleaned up 0 empty switches.

17. Executing CHECK pass (checking for obvious problems).
Checking module CSADD...
Checking module TCMP...
Checking module spm...
Found and reported 0 problems.

18. Executing OPT_EXPR pass (perform const folding).
Optimizing module CSADD.
Optimizing module TCMP.
Optimizing module spm.

19. Executing FLATTEN pass (flatten design).
Deleting now unused module CSADD.
Deleting now unused module TCMP.
<suppressed ~32 debug messages>

20. Executing OPT_EXPR pass (perform const folding).
Optimizing module spm.

21. Executing OPT_CLEAN pass (remove unused cells and wires).
Finding unused cells or wires in module \spm..
Removed 0 unused cells and 221 unused wires.
<suppressed ~2 debug messages>

22. Executing OPT pass (performing simple optimizations).

22.1. Executing OPT_EXPR pass (perform const folding).
Optimizing module spm.

22.2. Executing OPT_MERGE pass (detect identical cells).
Finding identical cells in module `\spm'.
Removed a total of 0 cells.

22.3. Executing OPT_MUXTREE pass (detect dead branches in mux trees).
Running muxtree optimizer on module \spm..
  Creating internal representation of mux trees.
  No muxes found in this module.
Removed 0 multiplexer ports.

22.4. Executing OPT_REDUCE pass (consolidate $*mux and $reduce_* inputs).
  Optimizing cells in module \spm.
Performed a total of 0 changes.

22.5. Executing OPT_MERGE pass (detect identical cells).
Finding identical cells in module `\spm'.
Removed a total of 0 cells.

22.6. Executing OPT_DFF pass (perform DFF optimizations).

22.7. Executing OPT_CLEAN pass (remove unused cells and wires).
Finding unused cells or wires in module \spm..

22.8. Executing OPT_EXPR pass (perform const folding).
Optimizing module spm.

22.9. Finished OPT passes. (There is nothing left to do.)

23. Executing FSM pass (extract and optimize FSM).

23.1. Executing FSM_DETECT pass (finding FSMs in design).

23.2. Executing FSM_EXTRACT pass (extracting FSM from design).

23.3. Executing FSM_OPT pass (simple optimizations of FSMs).

23.4. Executing OPT_CLEAN pass (remove unused cells and wires).
Finding unused cells or wires in module \spm..

23.5. Executing FSM_OPT pass (simple optimizations of FSMs).

23.6. Executing FSM_RECODE pass (re-assigning FSM state encoding).

23.7. Executing FSM_INFO pass (dumping all available information on FSM cells).

23.8. Executing FSM_MAP pass (mapping FSMs to basic logic).

24. Executing OPT pass (performing simple optimizations).

24.1. Executing OPT_EXPR pass (perform const folding).
Optimizing module spm.

24.2. Executing OPT_MERGE pass (detect identical cells).
Finding identical cells in module `\spm'.
Removed a total of 0 cells.

24.3. Executing OPT_MUXTREE pass (detect dead branches in mux trees).
Running muxtree optimizer on module \spm..
  Creating internal representation of mux trees.
  No muxes found in this module.
Removed 0 multiplexer ports.

24.4. Executing OPT_REDUCE pass (consolidate $*mux and $reduce_* inputs).
  Optimizing cells in module \spm.
Performed a total of 0 changes.

24.5. Executing OPT_MERGE pass (detect identical cells).
Finding identical cells in module `\spm'.
Removed a total of 0 cells.

24.6. Executing OPT_DFF pass (perform DFF optimizations).

24.7. Executing OPT_CLEAN pass (remove unused cells and wires).
Finding unused cells or wires in module \spm..

24.8. Executing OPT_EXPR pass (perform const folding).
Optimizing module spm.

24.9. Finished OPT passes. (There is nothing left to do.)

25. Executing WREDUCE pass (reducing word size of cells).

26. Executing PEEPOPT pass (run peephole optimizers).

27. Executing OPT_CLEAN pass (remove unused cells and wires).
Finding unused cells or wires in module \spm..

28. Executing ALUMACC pass (create $alu and $macc cells).
Extracting $alu and $macc cells in module spm:
  created 0 $alu and 0 $macc cells.

29. Executing SHARE pass (SAT-based resource sharing).

30. Executing OPT pass (performing simple optimizations).

30.1. Executing OPT_EXPR pass (perform const folding).
Optimizing module spm.

30.2. Executing OPT_MERGE pass (detect identical cells).
Finding identical cells in module `\spm'.
Removed a total of 0 cells.

30.3. Executing OPT_MUXTREE pass (detect dead branches in mux trees).
Running muxtree optimizer on module \spm..
  Creating internal representation of mux trees.
  No muxes found in this module.
Removed 0 multiplexer ports.

30.4. Executing OPT_REDUCE pass (consolidate $*mux and $reduce_* inputs).
  Optimizing cells in module \spm.
Performed a total of 0 changes.

30.5. Executing OPT_MERGE pass (detect identical cells).
Finding identical cells in module `\spm'.
Removed a total of 0 cells.

30.6. Executing OPT_DFF pass (perform DFF optimizations).

30.7. Executing OPT_CLEAN pass (remove unused cells and wires).
Finding unused cells or wires in module \spm..

30.8. Executing OPT_EXPR pass (perform const folding).
Optimizing module spm.

30.9. Finished OPT passes. (There is nothing left to do.)

31. Executing MEMORY pass.

31.1. Executing OPT_MEM pass (optimize memories).
Performed a total of 0 transformations.

31.2. Executing OPT_MEM_PRIORITY pass (removing unnecessary memory write priority relations).
Performed a total of 0 transformations.

31.3. Executing OPT_MEM_FEEDBACK pass (finding memory read-to-write feedback paths).

31.4. Executing MEMORY_BMUX2ROM pass (converting muxes to ROMs).

31.5. Executing MEMORY_DFF pass (merging $dff cells to $memrd).

31.6. Executing OPT_CLEAN pass (remove unused cells and wires).
Finding unused cells or wires in module \spm..

31.7. Executing MEMORY_SHARE pass (consolidating $memrd/$memwr cells).

31.8. Executing OPT_MEM_WIDEN pass (optimize memories where all ports are wide).
Performed a total of 0 transformations.

31.9. Executing OPT_CLEAN pass (remove unused cells and wires).
Finding unused cells or wires in module \spm..

31.10. Executing MEMORY_COLLECT pass (generating $mem cells).

32. Executing OPT_CLEAN pass (remove unused cells and wires).
Finding unused cells or wires in module \spm..

33. Executing OPT pass (performing simple optimizations).

33.1. Executing OPT_EXPR pass (perform const folding).
Optimizing module spm.

33.2. Executing OPT_MERGE pass (detect identical cells).
Finding identical cells in module `\spm'.
Removed a total of 0 cells.

33.3. Executing OPT_DFF pass (perform DFF optimizations).

33.4. Executing OPT_CLEAN pass (remove unused cells and wires).
Finding unused cells or wires in module \spm..

33.5. Finished fast OPT passes.

34. Executing MEMORY_MAP pass (converting memories to logic and flip-flops).

35. Executing OPT pass (performing simple optimizations).

35.1. Executing OPT_EXPR pass (perform const folding).
Optimizing module spm.

35.2. Executing OPT_MERGE pass (detect identical cells).
Finding identical cells in module `\spm'.
Removed a total of 0 cells.

35.3. Executing OPT_MUXTREE pass (detect dead branches in mux trees).
Running muxtree optimizer on module \spm..
  Creating internal representation of mux trees.
  No muxes found in this module.
Removed 0 multiplexer ports.

35.4. Executing OPT_REDUCE pass (consolidate $*mux and $reduce_* inputs).
  Optimizing cells in module \spm.
Performed a total of 0 changes.

35.5. Executing OPT_MERGE pass (detect identical cells).
Finding identical cells in module `\spm'.
Removed a total of 0 cells.

35.6. Executing OPT_SHARE pass.

35.7. Executing OPT_DFF pass (perform DFF optimizations).

35.8. Executing OPT_CLEAN pass (remove unused cells and wires).
Finding unused cells or wires in module \spm..

35.9. Executing OPT_EXPR pass (perform const folding).
Optimizing module spm.

35.10. Finished OPT passes. (There is nothing left to do.)

36. Executing TECHMAP pass (map to technology primitives).

36.1. Executing Verilog-2005 frontend: /build/bin/../share/yosys/techmap.v
Parsing Verilog input from `/build/bin/../share/yosys/techmap.v' to AST representation.
Generating RTLIL representation for module `\_90_simplemap_bool_ops'.
Generating RTLIL representation for module `\_90_simplemap_reduce_ops'.
Generating RTLIL representation for module `\_90_simplemap_logic_ops'.
Generating RTLIL representation for module `\_90_simplemap_compare_ops'.
Generating RTLIL representation for module `\_90_simplemap_various'.
Generating RTLIL representation for module `\_90_simplemap_registers'.
Generating RTLIL representation for module `\_90_shift_ops_shr_shl_sshl_sshr'.
Generating RTLIL representation for module `\_90_shift_shiftx'.
Generating RTLIL representation for module `\_90_fa'.
Generating RTLIL representation for module `\_90_lcu'.
Generating RTLIL representation for module `\_90_alu'.
Generating RTLIL representation for module `\_90_macc'.
Generating RTLIL representation for module `\_90_alumacc'.
Generating RTLIL representation for module `\$__div_mod_u'.
Generating RTLIL representation for module `\$__div_mod_trunc'.
Generating RTLIL representation for module `\_90_div'.
Generating RTLIL representation for module `\_90_mod'.
Generating RTLIL representation for module `\$__div_mod_floor'.
Generating RTLIL representation for module `\_90_divfloor'.
Generating RTLIL representation for module `\_90_modfloor'.
Generating RTLIL representation for module `\_90_pow'.
Generating RTLIL representation for module `\_90_pmux'.
Generating RTLIL representation for module `\_90_demux'.
Generating RTLIL representation for module `\_90_lut'.
Successfully finished Verilog frontend.

36.2. Continuing TECHMAP pass.
Using extmapper simplemap for cells of type $and.
Using extmapper simplemap for cells of type $adff.
Using extmapper simplemap for cells of type $xor.
Using extmapper simplemap for cells of type $or.
No more expansions possible.
<suppressed ~326 debug messages>

37. Executing OPT pass (performing simple optimizations).

37.1. Executing OPT_EXPR pass (perform const folding).
Optimizing module spm.

37.2. Executing OPT_MERGE pass (detect identical cells).
Finding identical cells in module `\spm'.
Removed a total of 0 cells.

37.3. Executing OPT_DFF pass (perform DFF optimizations).

37.4. Executing OPT_CLEAN pass (remove unused cells and wires).
Finding unused cells or wires in module \spm..

37.5. Finished fast OPT passes.

38. Executing ABC pass (technology mapping using ABC).

38.1. Extracting gate netlist of module `\spm' to `<abc-temp-dir>/input.blif'..
Extracted 189 gates and 285 wires to a netlist network with 96 inputs and 64 outputs.

38.1.1. Executing ABC.
Running ABC command: "<yosys-exe-dir>/yosys-abc" -s -f <abc-temp-dir>/abc.script 2>&1
ABC: ABC command line: "source <abc-temp-dir>/abc.script".
ABC: 
ABC: + read_blif <abc-temp-dir>/input.blif 
ABC: + read_library <abc-temp-dir>/stdcells.genlib 
ABC: Entered genlib library with 13 gates from file "<abc-temp-dir>/stdcells.genlib".
ABC: + strash 
ABC: + dretime 
ABC: + map 
ABC: + write_blif <abc-temp-dir>/output.blif 

38.1.2. Re-integrating ABC results.
ABC RESULTS:                OR cells:        1
ABC RESULTS:               AND cells:       32
ABC RESULTS:              NAND cells:       31
ABC RESULTS:              XNOR cells:       31
ABC RESULTS:               NOR cells:       31
ABC RESULTS:               XOR cells:       63
ABC RESULTS:        internal signals:      125
ABC RESULTS:           input signals:       96
ABC RESULTS:          output signals:       64
Removing temp directory.

39. Executing OPT pass (performing simple optimizations).

39.1. Executing OPT_EXPR pass (perform const folding).
Optimizing module spm.

39.2. Executing OPT_MERGE pass (detect identical cells).
Finding identical cells in module `\spm'.
Removed a total of 0 cells.

39.3. Executing OPT_DFF pass (perform DFF optimizations).

39.4. Executing OPT_CLEAN pass (remove unused cells and wires).
Finding unused cells or wires in module \spm..
Removed 0 unused cells and 285 unused wires.
<suppressed ~126 debug messages>

39.5. Finished fast OPT passes.

40. Executing HIERARCHY pass (managing design hierarchy).

40.1. Analyzing design hierarchy..
Top module:  \spm

40.2. Analyzing design hierarchy..
Top module:  \spm
Removed 0 unused modules.

41. Printing statistics.

=== spm ===

   Number of wires:                354
   Number of wire bits:            415
   Number of public wires:         196
   Number of public wire bits:     257
   Number of memories:               0
   Number of memory bits:            0
   Number of processes:              0
   Number of cells:                253
     $_AND_                         32
     $_DFF_PP0_                     64
     $_NAND_                        31
     $_NOR_                         31
     $_OR_                           1
     $_XNOR_                        31
     $_XOR_                         63

42. Executing CHECK pass (checking for obvious problems).
Checking module spm...
Found and reported 0 problems.

43. Generating Graphviz representation of design.
Writing dot description to `/openlane/designs/spm/runs/openlane_test/tmp/synthesis/post_techmap.dot'.
Dumping module spm to page 1.

44. Executing SHARE pass (SAT-based resource sharing).

45. Executing OPT pass (performing simple optimizations).

45.1. Executing OPT_EXPR pass (perform const folding).
Optimizing module spm.

45.2. Executing OPT_MERGE pass (detect identical cells).
Finding identical cells in module `\spm'.
Removed a total of 0 cells.

45.3. Executing OPT_MUXTREE pass (detect dead branches in mux trees).
Running muxtree optimizer on module \spm..
  Creating internal representation of mux trees.
  No muxes found in this module.
Removed 0 multiplexer ports.

45.4. Executing OPT_REDUCE pass (consolidate $*mux and $reduce_* inputs).
  Optimizing cells in module \spm.
Performed a total of 0 changes.

45.5. Executing OPT_MERGE pass (detect identical cells).
Finding identical cells in module `\spm'.
Removed a total of 0 cells.

45.6. Executing OPT_DFF pass (perform DFF optimizations).

45.7. Executing OPT_CLEAN pass (remove unused cells and wires).
Finding unused cells or wires in module \spm..

45.8. Executing OPT_EXPR pass (perform const folding).
Optimizing module spm.

45.9. Finished OPT passes. (There is nothing left to do.)

46. Executing OPT_CLEAN pass (remove unused cells and wires).
Finding unused cells or wires in module \spm..
Removed 0 unused cells and 97 unused wires.
<suppressed ~97 debug messages>

47. Printing statistics.

=== spm ===

   Number of wires:                257
   Number of wire bits:            288
   Number of public wires:          99
   Number of public wire bits:     130
   Number of memories:               0
   Number of memory bits:            0
   Number of processes:              0
   Number of cells:                253
     $_AND_                         32
     $_DFF_PP0_                     64
     $_NAND_                        31
     $_NOR_                         31
     $_OR_                           1
     $_XNOR_                        31
     $_XOR_                         63

mapping tbuf

48. Executing TECHMAP pass (map to technology primitives).

48.1. Executing Verilog-2005 frontend: /home/vscode/.ciel/sky130A/libs.tech/openlane/sky130_fd_sc_hd/tribuff_map.v
Parsing Verilog input from `/home/vscode/.ciel/sky130A/libs.tech/openlane/sky130_fd_sc_hd/tribuff_map.v' to AST representation.
Generating RTLIL representation for module `\$_TBUF_'.
Successfully finished Verilog frontend.

48.2. Continuing TECHMAP pass.
No more expansions possible.
<suppressed ~3 debug messages>

49. Executing SIMPLEMAP pass (map simple cells to gate primitives).

50. Executing TECHMAP pass (map to technology primitives).

50.1. Executing Verilog-2005 frontend: /home/vscode/.ciel/sky130A/libs.tech/openlane/sky130_fd_sc_hd/latch_map.v
Parsing Verilog input from `/home/vscode/.ciel/sky130A/libs.tech/openlane/sky130_fd_sc_hd/latch_map.v' to AST representation.
Generating RTLIL representation for module `\$_DLATCH_P_'.
Generating RTLIL representation for module `\$_DLATCH_N_'.
Successfully finished Verilog frontend.

50.2. Continuing TECHMAP pass.
No more expansions possible.
<suppressed ~4 debug messages>

51. Executing SIMPLEMAP pass (map simple cells to gate primitives).

52. Executing DFFLIBMAP pass (mapping DFF cells to sequential cells from liberty file).
  cell sky130_fd_sc_hd__dfxtp_2 (noninv, pins=3, area=21.27) is a direct match for cell type $_DFF_P_.
  cell sky130_fd_sc_hd__dfrtp_2 (noninv, pins=4, area=26.28) is a direct match for cell type $_DFF_PN0_.
  cell sky130_fd_sc_hd__dfstp_2 (noninv, pins=4, area=26.28) is a direct match for cell type $_DFF_PN1_.
  cell sky130_fd_sc_hd__dfbbn_2 (noninv, pins=6, area=35.03) is a direct match for cell type $_DFFSR_NNN_.
  final dff cell mappings:
    unmapped dff cell: $_DFF_N_
    \sky130_fd_sc_hd__dfxtp_2 _DFF_P_ (.CLK( C), .D( D), .Q( Q));
    unmapped dff cell: $_DFF_NN0_
    unmapped dff cell: $_DFF_NN1_
    unmapped dff cell: $_DFF_NP0_
    unmapped dff cell: $_DFF_NP1_
    \sky130_fd_sc_hd__dfrtp_2 _DFF_PN0_ (.CLK( C), .D( D), .Q( Q), .RESET_B( R));
    \sky130_fd_sc_hd__dfstp_2 _DFF_PN1_ (.CLK( C), .D( D), .Q( Q), .SET_B( R));
    unmapped dff cell: $_DFF_PP0_
    unmapped dff cell: $_DFF_PP1_
    \sky130_fd_sc_hd__dfbbn_2 _DFFSR_NNN_ (.CLK_N( C), .D( D), .Q( Q), .Q_N(~Q), .RESET_B( R), .SET_B( S));
    unmapped dff cell: $_DFFSR_NNP_
    unmapped dff cell: $_DFFSR_NPN_
    unmapped dff cell: $_DFFSR_NPP_
    unmapped dff cell: $_DFFSR_PNN_
    unmapped dff cell: $_DFFSR_PNP_
    unmapped dff cell: $_DFFSR_PPN_
    unmapped dff cell: $_DFFSR_PPP_

52.1. Executing DFFLEGALIZE pass (convert FFs to types supported by the target).
Mapping DFF cells in module `\spm':
  mapped 64 $_DFF_PN0_ cells to \sky130_fd_sc_hd__dfrtp_2 cells.

53. Printing statistics.

=== spm ===

   Number of wires:                321
   Number of wire bits:            352
   Number of public wires:          99
   Number of public wire bits:     130
   Number of memories:               0
   Number of memory bits:            0
   Number of processes:              0
   Number of cells:                317
     $_AND_                         32
     $_NAND_                        31
     $_NOR_                         31
     $_NOT_                         64
     $_OR_                           1
     $_XNOR_                        31
     $_XOR_                         63
     sky130_fd_sc_hd__dfrtp_2       64

[INFO]: USING STRATEGY AREA 0

54. Executing ABC pass (technology mapping using ABC).

54.1. Extracting gate netlist of module `\spm' to `/tmp/yosys-abc-Tcp9fU/input.blif'..
Extracted 253 gates and 350 wires to a netlist network with 97 inputs and 128 outputs.

54.1.1. Executing ABC.
Running ABC command: "/build/bin/yosys-abc" -s -f /tmp/yosys-abc-Tcp9fU/abc.script 2>&1
ABC: ABC command line: "source /tmp/yosys-abc-Tcp9fU/abc.script".
ABC: 
ABC: + read_blif /tmp/yosys-abc-Tcp9fU/input.blif 
ABC: + read_lib -w /openlane/designs/spm/runs/openlane_test/tmp/synthesis/trimmed.lib 
ABC: Parsing finished successfully.  Parsing time =     0.04 sec
ABC: Scl_LibertyReadGenlib() skipped sequential cell "sky130_fd_sc_hd__dfbbn_2".
ABC: Scl_LibertyReadGenlib() skipped sequential cell "sky130_fd_sc_hd__dfrbp_2".
ABC: Scl_LibertyReadGenlib() skipped sequential cell "sky130_fd_sc_hd__dfrtp_2".
ABC: Scl_LibertyReadGenlib() skipped sequential cell "sky130_fd_sc_hd__dfrtp_4".
ABC: Scl_LibertyReadGenlib() skipped sequential cell "sky130_fd_sc_hd__dfsbp_2".
ABC: Scl_LibertyReadGenlib() skipped sequential cell "sky130_fd_sc_hd__dfstp_2".
ABC: Scl_LibertyReadGenlib() skipped sequential cell "sky130_fd_sc_hd__dfstp_4".
ABC: Scl_LibertyReadGenlib() skipped sequential cell "sky130_fd_sc_hd__dfxbp_2".
ABC: Scl_LibertyReadGenlib() skipped sequential cell "sky130_fd_sc_hd__dfxtp_2".
ABC: Scl_LibertyReadGenlib() skipped sequential cell "sky130_fd_sc_hd__dfxtp_4".
ABC: Scl_LibertyReadGenlib() skipped sequential cell "sky130_fd_sc_hd__dlxtn_1".
ABC: Scl_LibertyReadGenlib() skipped sequential cell "sky130_fd_sc_hd__dlxtn_2".
ABC: Scl_LibertyReadGenlib() skipped sequential cell "sky130_fd_sc_hd__dlxtn_4".
ABC: Scl_LibertyReadGenlib() skipped sequential cell "sky130_fd_sc_hd__dlxtp_1".
ABC: Scl_LibertyReadGenlib() skipped three-state cell "sky130_fd_sc_hd__ebufn_2".
ABC: Scl_LibertyReadGenlib() skipped three-state cell "sky130_fd_sc_hd__ebufn_4".
ABC: Scl_LibertyReadGenlib() skipped three-state cell "sky130_fd_sc_hd__ebufn_8".
ABC: Library "sky130A_merged" from "/openlane/designs/spm/runs/openlane_test/tmp/synthesis/trimmed.lib" has 175 cells (17 skipped: 14 seq; 3 tri-state; 0 no func; 0 dont_use).  Time =     0.07 sec
ABC: Memory =    9.54 MB. Time =     0.07 sec
ABC: Warning: Detected 2 multi-output gates (for example, "sky130_fd_sc_hd__fa_1").
ABC: + read_constr -v /openlane/designs/spm/runs/openlane_test/tmp/synthesis/synthesis.sdc 
ABC: Setting driving cell to be "sky130_fd_sc_hd__inv_2".
ABC: Setting output load to be 33.442001.
ABC: + read_constr /openlane/designs/spm/runs/openlane_test/tmp/synthesis/synthesis.sdc 
ABC: + fx 
ABC: + mfs 
ABC: + strash 
ABC: + refactor 
ABC: + balance 
ABC: + rewrite 
ABC: + refactor 
ABC: + balance 
ABC: + rewrite 
ABC: + rewrite -z 
ABC: + balance 
ABC: + refactor -z 
ABC: + rewrite -z 
ABC: + balance 
ABC: + retime -D -D 10000 -M 5 
ABC: + scleanup 
ABC: Error: The network is combinational.
ABC: + fraig_store 
ABC: + balance 
ABC: + fraig_store 
ABC: + balance 
ABC: + rewrite 
ABC: + refactor 
ABC: + balance 
ABC: + rewrite 
ABC: + rewrite -z 
ABC: + balance 
ABC: + refactor -z 
ABC: + rewrite -z 
ABC: + balance 
ABC: + fraig_store 
ABC: + balance 
ABC: + rewrite 
ABC: + refactor 
ABC: + balance 
ABC: + rewrite 
ABC: + rewrite -z 
ABC: + balance 
ABC: + refactor -z 
ABC: + rewrite -z 
ABC: + balance 
ABC: + fraig_store 
ABC: + balance 
ABC: + rewrite 
ABC: + refactor 
ABC: + balance 
ABC: + rewrite 
ABC: + rewrite -z 
ABC: + balance 
ABC: + refactor -z 
ABC: + rewrite -z 
ABC: + balance 
ABC: + fraig_store 
ABC: + fraig_restore 
ABC: + amap -m -Q 0.1 -F 20 -A 20 -C 5000 
ABC: + retime -D -D 10000 
ABC: + &get -n 
ABC: + &st 
ABC: + &dch 
ABC: + &nf 
ABC: + &put 
ABC: + buffer -N 10 -S 750.0 
ABC: + upsize -D 10000 
ABC: Current delay (777.66 ps) does not exceed the target delay (10000.00 ps). Upsizing is not performed.
ABC: + dnsize -D 10000 
ABC: + stime -p 
ABC: WireLoad = "none"  Gates =    237 ( 33.3 %)   Cap = 19.0 ff (  5.0 %)   Area =     2029.45 ( 66.7 %)   Delay =  1378.31 ps  ( 32.5 %)               
ABC: Path  0 --       3 : 0    1 pi                      A =   0.00  Df =   8.2   -5.1 ps  S =  17.7 ps  Cin =  0.0 ff  Cout =   2.2 ff  Cmax =   0.0 ff  G =    0  
ABC: Path  1 --     226 : 1   10 sky130_fd_sc_hd__buf_1  A =   3.75  Df = 342.8 -134.4 ps  S = 427.1 ps  Cin =  2.1 ff  Cout =  36.2 ff  Cmax = 130.0 ff  G = 1671  
ABC: Path  2 --     227 : 1   10 sky130_fd_sc_hd__buf_1  A =   3.75  Df = 743.5 -252.9 ps  S = 428.7 ps  Cin =  2.1 ff  Cout =  36.4 ff  Cmax = 130.0 ff  G = 1676  
ABC: Path  3 --     228 : 1   10 sky130_fd_sc_hd__buf_1  A =   3.75  Df =1051.4 -325.5 ps  S = 294.5 ps  Cin =  2.1 ff  Cout =  24.6 ff  Cmax = 130.0 ff  G = 1127  
ABC: Path  4 --     231 : 4    1 sky130_fd_sc_hd__a31o_2 A =   8.76  Df =1378.3 -340.7 ps  S = 199.0 ps  Cin =  2.4 ff  Cout =  33.4 ff  Cmax = 271.9 ff  G = 1420  
ABC: Start-point = pi2 (\y).  End-point = po0 ($abc$376$flatten\csa0.$0\sc[0:0]).
ABC: + print_stats -m 
ABC: netlist                       : i/o =   97/  128  lat =    0  nd =   237  edge =    459  area =2029.70  delay = 4.00  lev = 4
ABC: + write_blif /tmp/yosys-abc-Tcp9fU/output.blif 

54.1.2. Re-integrating ABC results.
ABC RESULTS:   sky130_fd_sc_hd__a21o_2 cells:        1
ABC RESULTS:   sky130_fd_sc_hd__nand3_2 cells:        1
ABC RESULTS:   sky130_fd_sc_hd__xor2_2 cells:       31
ABC RESULTS:   sky130_fd_sc_hd__and2_2 cells:       32
ABC RESULTS:   sky130_fd_sc_hd__a31o_2 cells:       31
ABC RESULTS:   sky130_fd_sc_hd__nand2_2 cells:       31
ABC RESULTS:   sky130_fd_sc_hd__xnor2_2 cells:       31
ABC RESULTS:   sky130_fd_sc_hd__buf_1 cells:       15
ABC RESULTS:   sky130_fd_sc_hd__inv_2 cells:       64
ABC RESULTS:        internal signals:      125
ABC RESULTS:           input signals:       97
ABC RESULTS:          output signals:      128
Removing temp directory.

55. Executing SETUNDEF pass (replace undef values with defined constants).

56. Executing HILOMAP pass (mapping to constant drivers).

57. Executing SPLITNETS pass (splitting up multi-bit signals).

58. Executing OPT_CLEAN pass (remove unused cells and wires).
Finding unused cells or wires in module \spm..
Removed 0 unused cells and 350 unused wires.
<suppressed ~1 debug messages>

59. Executing INSBUF pass (insert buffer cells for connected wires).

60. Executing CHECK pass (checking for obvious problems).
Checking module spm...
Warning: Wire spm.\p is used but has no driver.
Found and reported 1 problems.

61. Printing statistics.

=== spm ===

   Number of wires:                305
   Number of wire bits:            336
   Number of public wires:          99
   Number of public wire bits:     130
   Number of memories:               0
   Number of memory bits:            0
   Number of processes:              0
   Number of cells:                301
     sky130_fd_sc_hd__a21o_2         1
     sky130_fd_sc_hd__a31o_2        31
     sky130_fd_sc_hd__and2_2        32
     sky130_fd_sc_hd__buf_1         15
     sky130_fd_sc_hd__dfrtp_2       64
     sky130_fd_sc_hd__inv_2         64
     sky130_fd_sc_hd__nand2_2       31
     sky130_fd_sc_hd__nand3_2        1
     sky130_fd_sc_hd__xnor2_2       31
     sky130_fd_sc_hd__xor2_2        31

   Chip area for module '\spm': 3711.059200

62. Executing Verilog backend.
Dumping module `\spm'.

Warnings: 1 unique messages, 1 total
End of script. Logfile hash: ef610b4471, CPU: user 0.50s system 0.02s, MEM: 29.38 MB peak
Yosys 0.30+48 (git sha1 14d50a176d5, gcc 8.3.1 -fPIC -Os)
Time spent: 40% 2x abc (0 sec), 12% 1x dfflibmap (0 sec), ...
